{
  "benchmark": {
    "control_verdict": "comparable",
    "same_score_verdict": "partially_comparable"
  },
  "evidence_limits": [
    "deterministic_fixture_not_real_model_measurement",
    "cost_units_are_not_provider_prices",
    "tail_samples_are_diagnostic_not_population_denominators",
    "no_platform_conformance_claim"
  ],
  "fixture": {
    "fixture_version": "chapter14.trace-fixture.v1",
    "release_counts": {
      "fixed": 24,
      "incident": 24,
      "stable": 24
    },
    "release_ids": [
      "stable",
      "incident",
      "fixed"
    ],
    "scored_trace_count": 72,
    "slice_counts": {
      "recovery": 18,
      "retrieval": 18,
      "simple": 18,
      "write": 18
    }
  },
  "group_artifacts": [
    "group-1.json",
    "group-2.json",
    "group-3.json",
    "group-4.json",
    "group-5.json"
  ],
  "incident_report": {
    "ablation_results": [
      {
        "all_canonical_symptoms_removed": false,
        "cost_units_total": 17.74,
        "evidence_mode": "deterministic_counterfactual_fixture",
        "hypothesis": "model",
        "intervention": "hold_model_at_stable_contract",
        "latency_p95_ms": 612.0,
        "outcome_score_mean": 0.958333,
        "removed_symptoms": [],
        "retry_amplification": 1.4375
      },
      {
        "all_canonical_symptoms_removed": false,
        "cost_units_total": 17.74,
        "evidence_mode": "deterministic_counterfactual_fixture",
        "hypothesis": "prompt",
        "intervention": "hold_prompt_at_stable_contract",
        "latency_p95_ms": 612.0,
        "outcome_score_mean": 0.958333,
        "removed_symptoms": [],
        "retry_amplification": 1.4375
      },
      {
        "all_canonical_symptoms_removed": false,
        "cost_units_total": 16.885,
        "evidence_mode": "deterministic_counterfactual_fixture",
        "hypothesis": "context_assembly",
        "intervention": "hold_context_assembly_at_stable_contract",
        "latency_p95_ms": 612.0,
        "outcome_score_mean": 0.958333,
        "removed_symptoms": [],
        "retry_amplification": 1.4375
      },
      {
        "all_canonical_symptoms_removed": false,
        "cost_units_total": 17.74,
        "evidence_mode": "deterministic_counterfactual_fixture",
        "hypothesis": "tool_latency",
        "intervention": "hold_tool_latency_at_stable_contract",
        "latency_p95_ms": 432.0,
        "outcome_score_mean": 0.958333,
        "removed_symptoms": [
          "latency"
        ],
        "retry_amplification": 1.4375
      },
      {
        "all_canonical_symptoms_removed": true,
        "cost_units_total": 16.03,
        "evidence_mode": "deterministic_counterfactual_fixture",
        "hypothesis": "retry_policy",
        "intervention": "hold_retry_policy_at_stable_contract",
        "latency_p95_ms": 432.0,
        "outcome_score_mean": 0.958333,
        "removed_symptoms": [
          "latency",
          "cost",
          "retry_amplification"
        ],
        "retry_amplification": 1.3125
      }
    ],
    "affected_slices": [
      "recovery"
    ],
    "candidate_causes": [
      "model",
      "prompt",
      "context_assembly",
      "tool_latency",
      "retry_policy"
    ],
    "conclusion": "confirmed",
    "confidence": 0.92,
    "counterevidence_trace_ids": [
      "trace-incident-simple-01",
      "trace-incident-simple-02",
      "trace-incident-simple-03",
      "trace-incident-simple-04"
    ],
    "data_completeness": 0.958333,
    "recommended_actions": [
      "bound_retry_scope_to_the_failed_tool_call",
      "replay_recovery_slices_before_release",
      "retain_population_counters_when_traces_are_sampled"
    ],
    "regression_task_ids": [
      "reg-retry-latency",
      "reg-retry-cost",
      "reg-retry-amplification"
    ],
    "root_cause": "retry_policy",
    "supporting_trace_ids": [
      "trace-incident-recovery-01",
      "trace-incident-recovery-03",
      "trace-incident-recovery-05"
    ],
    "symptom": "outcome stable while p95 latency, cost units, and retry amplification regress",
    "unknowns": [
      "provider_usage_partially_missing",
      "fixture_does_not_prove_real_world_causality"
    ]
  },
  "regression_tasks": [
    {
      "assertion": "fixed p95 latency is no worse than stable",
      "slice": "recovery",
      "source_trace_ids": [
        "trace-incident-recovery-01",
        "trace-incident-recovery-03",
        "trace-incident-recovery-05"
      ],
      "task_id": "reg-retry-latency"
    },
    {
      "assertion": "retry does not repeat context assembly or model planning",
      "slice": "recovery",
      "source_trace_ids": [
        "trace-incident-recovery-01",
        "trace-incident-recovery-03",
        "trace-incident-recovery-05"
      ],
      "task_id": "reg-retry-cost"
    },
    {
      "assertion": "retry amplification returns to the stable bound",
      "slice": "recovery",
      "source_trace_ids": [
        "trace-incident-recovery-01",
        "trace-incident-recovery-03",
        "trace-incident-recovery-05"
      ],
      "task_id": "reg-retry-amplification"
    }
  ],
  "release_comparison": {
    "fixed_vs_incident": {
      "cost_units_total_delta": -1.71,
      "latency_p95_ms_delta": -180,
      "outcome_score_mean_delta": 0.0,
      "retry_amplification_delta": -0.125
    },
    "incident_vs_stable": {
      "cost_units_total_delta": 1.71,
      "latency_p95_ms_delta": 180,
      "outcome_score_mean_delta": 0.0,
      "retry_amplification_delta": 0.125
    },
    "limits": [
      "deterministic_fixture_only",
      "cost_units_are_not_provider_prices"
    ],
    "release_order": [
      "stable",
      "incident",
      "fixed"
    ]
  },
  "release_summaries": {
    "fixed": {
      "algorithm_versions": {
        "critical_path": "work-dag-longest-path.v1",
        "percentile": "nearest-rank.v1",
        "retry_amplification": "billable-attempts-per-declared-operation.v1"
      },
      "critical_path_ms": {
        "p50": 262.0,
        "p95": 392.0
      },
      "error_span_count": 7,
      "latency_ms": {
        "max": 440,
        "p50": 292,
        "p95": 432
      },
      "outcome_score_mean": 0.958333,
      "rate_card_version": "chapter14.cost-units.v1",
      "release_id": "fixed",
      "retry_amplification": 1.3125,
      "slices": {
        "recovery": {
          "latency_p95_ms": 440,
          "outcome_score_mean": 0.833333,
          "success_rate": 0.833333,
          "trace_count": 6
        },
        "retrieval": {
          "latency_p95_ms": 343,
          "outcome_score_mean": 1.0,
          "success_rate": 1.0,
          "trace_count": 6
        },
        "simple": {
          "latency_p95_ms": 177,
          "outcome_score_mean": 1.0,
          "success_rate": 1.0,
          "trace_count": 6
        },
        "write": {
          "latency_p95_ms": 292,
          "outcome_score_mean": 1.0,
          "success_rate": 1.0,
          "trace_count": 6
        }
      },
      "status_counts": {
        "failure": 1,
        "success": 23
      },
      "success_count": 23,
      "telemetry_complete_count": 23,
      "telemetry_complete_rate": 0.958333,
      "trace_count": 24,
      "usage": {
        "cost_field_coverage": 1.0,
        "cost_units_total": 16.03,
        "input_tokens_total": 4866,
        "missing_token_fields": 1,
        "output_tokens_total": 1457,
        "token_field_coverage": 0.983333
      },
      "work_span_duration_sum_ms": 6678
    },
    "incident": {
      "algorithm_versions": {
        "critical_path": "work-dag-longest-path.v1",
        "percentile": "nearest-rank.v1",
        "retry_amplification": "billable-attempts-per-declared-operation.v1"
      },
      "critical_path_ms": {
        "p50": 262.0,
        "p95": 562.0
      },
      "error_span_count": 7,
      "latency_ms": {
        "max": 620,
        "p50": 292,
        "p95": 612
      },
      "outcome_score_mean": 0.958333,
      "rate_card_version": "chapter14.cost-units.v1",
      "release_id": "incident",
      "retry_amplification": 1.4375,
      "slices": {
        "recovery": {
          "latency_p95_ms": 620,
          "outcome_score_mean": 0.833333,
          "success_rate": 0.833333,
          "trace_count": 6
        },
        "retrieval": {
          "latency_p95_ms": 343,
          "outcome_score_mean": 1.0,
          "success_rate": 1.0,
          "trace_count": 6
        },
        "simple": {
          "latency_p95_ms": 177,
          "outcome_score_mean": 1.0,
          "success_rate": 1.0,
          "trace_count": 6
        },
        "write": {
          "latency_p95_ms": 292,
          "outcome_score_mean": 1.0,
          "success_rate": 1.0,
          "trace_count": 6
        }
      },
      "status_counts": {
        "failure": 1,
        "success": 23
      },
      "success_count": 23,
      "telemetry_complete_count": 23,
      "telemetry_complete_rate": 0.958333,
      "trace_count": 24,
      "usage": {
        "cost_field_coverage": 1.0,
        "cost_units_total": 17.74,
        "input_tokens_total": 5496,
        "missing_token_fields": 1,
        "output_tokens_total": 1622,
        "token_field_coverage": 0.984848
      },
      "work_span_duration_sum_ms": 7188
    },
    "stable": {
      "algorithm_versions": {
        "critical_path": "work-dag-longest-path.v1",
        "percentile": "nearest-rank.v1",
        "retry_amplification": "billable-attempts-per-declared-operation.v1"
      },
      "critical_path_ms": {
        "p50": 262.0,
        "p95": 392.0
      },
      "error_span_count": 7,
      "latency_ms": {
        "max": 440,
        "p50": 292,
        "p95": 432
      },
      "outcome_score_mean": 0.958333,
      "rate_card_version": "chapter14.cost-units.v1",
      "release_id": "stable",
      "retry_amplification": 1.3125,
      "slices": {
        "recovery": {
          "latency_p95_ms": 440,
          "outcome_score_mean": 0.833333,